{
  "algorithm": "mandatory-set-plus-sha256-stratified-random-v1",
  "eligible_case_count": 0,
  "mandatory_unique_case_count": 0,
  "members": [],
  "random_case_count": 0,
  "schema_version": "1.0",
  "selection_state": "draft",
  "seed": "phase5-pilot-review-v1-20260823",
  "zero_finding_repository_count": 0
}
